### ISSUE TITLE
TLS error when trying to use even the example docker-compose.yml

### ISSUE THREAD

**Issue by heartpunk** [hollie/tailscale-caddy-proxy#3]
I've tried this with a custom config inspired by your default, as well as the example yaml file, on two separate hosts on the same tailnet. The issue persists after many attempts at debugging. I presume caddy must be having difficulty obtaining the cert somehow, but the tailscale CLI is able to obtain the cert inside the container on both hosts.

I've attached a snippet of the error from a wireshark trace (seen directly after the Client Hello):

```
Frame 1140338: 59 bytes on wire (472 bits), 59 bytes captured (472 bits) on interface utun4, id 1
Raw packet data
Internet Protocol Version 4, Src: 100.66.48.115, Dst: 100.115.37.10
Transmission Control Protocol, Src Port: 443, Dst Port: 63876, Seq: 1, Ack: 518, Len: 7
Transport Layer Security
    TLSv1.2 Record Layer: Alert (Level: Fatal, Description: Internal Error)
        Content Type: Alert (21)
        Version: TLS 1.2 (0x0303)
        Length: 2
        Alert Message
            Level: Fatal (2)
            Description: Internal Error (80)
```

Given the issue persists across two separate hosts running docker in different ways, and presumably the issue is not occurring for you in your usage, I suspect it must be related to my tailnet. I have ensured I have both SSL and MagicDNS enabled.

I'll be glad to provide any further context that could be of use to resolve this issue, especially as your project is nearly exactly the thing I was close to building myself (and done a bit better than I would've known how to!). Looking forward to hearing back from you!

**Comment by heartpunk** [comment]
I'm pretty sure this is a dupe of #2, I wish I'd understood that issue earlier in my debugging process. It works fine now that I'm trying to load by FQDN. I do wish this weren't necessary, though, as a partial domain was a goal I was really aiming for here! Oh well. With autocomplete it'll be convenient enough, but it sure would be nice if it could support the smallest unique prefix.

**Comment by hollie** [comment]
Hey @heartpunk,

you can't request a certificate for a non-fully qualified domain name. The certificate authority needs a way to check that you are actually entitled to request a certificate. This is handled in the background by Tailscale and it involves a communication between the certificate authority and your machine. This can only happen through a FQDN as the certificate authority is not on Tailscale obviously.

I guess it is OK to close this ticket?

Regards,
 Hollie.

**Comment by hollie** [comment]
I've added an extra note to the documentation with the info that you need to use the FQDN to access the host.

https://github.com/hollie/tailscale-caddy-proxy/commit/3b966d9e9542942431a13531a54dc80b10d26775

**Comment by heartpunk** [comment]
Yea, go ahead and close it.

Your point is a good one though, helps me understand why I've seen this done in certain intranets, but it can't be done (trivially at least) with a cert from a public CA. If you control the CA and the client devices' trusted roots, then you could absolutely do this ([this StackOverflow comment](https://security.stackexchange.com/questions/260451/is-it-ok-to-have-both-the-hostname-and-the-fqdn-of-a-server-in-an-ssl-certific#comment565065_271519) has some confirmation) I'm definitely not interested in running my own CA just for the aesthetics, in any case, but this is nice for learning's sake.

As a last little thought, it might be interesting to see if there's a way to redirect the bare hostnames to the FQDN in this case by way of a slightly elaborated Caddyfile? I do not have the requisite caddy knowhow to do this, but perhaps you do! That'd at least make it less broken looking if someone forgets to use the FQDN, as it *does* clearly reach caddy before the SSL error happens.

**Comment by hollie** [comment]
> As a last little thought, it might be interesting to see if there's a way to redirect the bare hostnames to the FQDN in this case by way of a slightly elaborated Caddyfile? I do not have the requisite caddy knowhow to do this, but perhaps you do! That'd at least make it less broken looking if someone forgets to use the FQDN, as it _does_ clearly reach caddy before the SSL error happens.

I did a quick search and while there are options to redirect to subparts of an URL, the issue is that you first need a domain to restrict the match on. With a pure hostname there is no domain, so there is nothing to put in the match rule I'm afraid.
